Keyword,Volume,KD,CPC,Pillar,Cluster,Funnel Stage,Monetization,Intent,Category,Parent Keyword
movio ai video generator,200,0,,AI Content Creation,AI Video Tools,BOF,Ads,"Informational,Branded,Non-local",Multimedia,heygen
ai video transitions,150,0,0.7,AI Content Creation,AI Video Tools,TOF,Ads,"Informational,Non-branded,Non-local",Online video,ai transition
facebook profile viewer anonymous,400,13,0.1,Anonymous Viewing,Facebook Viewer,TOF,"Ads, Affiliate (VPN), Own Tool","Informational,Branded,Non-local",Social networks,facebook profile viewer
facebook profile picture viewer,350,12,0.3,Anonymous Viewing,Facebook Viewer,TOF,"Ads, Own Tool","Informational,Branded,Non-local",Image sharing,facebook profile downloader
facebook photo viewer,300,2,0.07,Anonymous Viewing,Facebook Viewer,TOF,"Ads, Own Tool","Informational,Branded,Non-local",Social networks,facebook profile viewer
anonymous facebook profile viewer,250,13,,Anonymous Viewing,Facebook Viewer,TOF,"Ads, Affiliate (VPN), Own Tool","Informational,Branded,Non-local",Social networks,facebook anonymous viewer
facebook profile viewer online,100,12,0.3,Anonymous Viewing,Facebook Viewer,TOF,"Ads, Own Tool","Informational,Branded,Non-local",Social networks,view facebook anonymously
wayback machine instagram,1400,0,0.5,Anonymous Viewing,Instagram General,TOF,"Ads, Own Tool","Informational,Branded,Non-local",Web services,pittsburgh craigslist
instagram threads viewer,350,4,0.02,Anonymous Viewing,Instagram General,TOF,"Ads, Own Tool","Informational,Branded,Non-local",Social networks,threads viewer
like viewer instagram,150,5,,Anonymous Viewing,Instagram General,TOF,"Ads, Own Tool","Informational,Branded,Non-local",Social networks,instagram likes viewer
view instagram highlight cover full size,100,0,,Anonymous Viewing,Instagram General,TOF,"Ads, Own Tool","Informational,Branded,Non-local",Image sharing,instagram highlight viewer
instagram wayback,100,1,,Anonymous Viewing,Instagram General,TOF,"Ads, Own Tool","Informational,Branded,Non-local",Analytics; Hosting; Social networks,instagram archive website
reel viewer instagram,100,2,,Anonymous Viewing,Instagram General,TOF,"Ads, Own Tool","Informational,Branded,Non-local",Social networks,instagram reel viewer
instagram without account,3600,0,0.01,Anonymous Viewing,Instagram No-Account,TOF,"Ads, Own Tool","Informational,Branded,Non-local",Social networks,instagram guest mode
profile instagram viewer,100,14,,Anonymous Viewing,Instagram Profile Viewer,TOF,"Ads, Own Tool","Informational,Branded,Non-local",Social networks,instagram profile viewer
instagram tagged photos viewer,900,14,0.6,Anonymous Viewing,Instagram Tagged,TOF,"Ads, Own Tool","Informational,Branded,Non-local",Image sharing,instagram tagged viewer
instagram tagged posts viewer,200,4,,Anonymous Viewing,Instagram Tagged,TOF,"Ads, Own Tool","Informational,Branded,Non-local",Social networks,instagram tagged viewer
instagram tagged photo viewer,200,5,0.8,Anonymous Viewing,Instagram Tagged,TOF,"Ads, Own Tool","Informational,Branded,Non-local",Image sharing,instagram tagged photos viewer
private tiktok viewer,600,11,1.9,Anonymous Viewing,Private Profiles,TOF,"Ads, Own Tool","Informational,Branded,Non-local",Social networks,tiktok profile viewer
tiktok private account viewer,450,11,1.6,Anonymous Viewing,Private Profiles,TOF,"Ads, Own Tool","Informational,Branded,Non-local",Social networks,tiktok profile viewer
instagram private account viewer app,300,10,0.4,Anonymous Viewing,Private Profiles,TOF,"Ads, Affiliate, Own Tool","Informational,Non-branded,Non-local",Add-ons; Social networks,instagram private account viewer
can people see if i screenshot their instagram story,1000,0,,Anonymous Viewing,Screenshot Privacy,TOF,"Ads, Own Tool","Informational,Branded,Non-local",Social networks,how to know if someone screenshots your instagram story
do people get notified when you screenshot on instagram,450,0,,Anonymous Viewing,Screenshot Privacy,TOF,"Ads, Own Tool","Informational,Branded,Non-local",Social networks,if i screenshot someone's instagram story
can people see instagram story screenshots,400,0,,Anonymous Viewing,Screenshot Privacy,TOF,"Ads, Own Tool","Informational,Branded,Non-local",Social networks,does instagram notify when you screenshot
does someone know if you screenshot their instagram story,400,0,,Anonymous Viewing,Screenshot Privacy,TOF,"Ads, Own Tool","Informational,Branded,Non-local",Social networks,if i screenshot someone's instagram story
does instagram tell if you screenshot,350,3,,Anonymous Viewing,Screenshot Privacy,TOF,"Ads, Own Tool","Informational,Branded,Non-local",Social networks,does ig show screenshots
can instagram see screenshots story,300,0,,Anonymous Viewing,Screenshot Privacy,TOF,"Ads, Own Tool","Informational,Non-branded,Non-local",Social networks,can people tell if you screenshot their instagram story
does instagram notify when you screenshot a story 2024,300,3,,Anonymous Viewing,Screenshot Privacy,TOF,"Ads, Own Tool","Informational,Branded,Non-local",Social networks,how to know if someone screenshots your instagram story
can someone see if you screenshot their story on instagram,200,1,,Anonymous Viewing,Screenshot Privacy,TOF,"Ads, Own Tool","Informational,Branded,Non-local",Social networks,how to know if someone screenshots your instagram story
does instagram show if you screenshot,150,0,,Anonymous Viewing,Screenshot Privacy,TOF,"Ads, Own Tool","Informational,Branded,Non-local",Social networks,does instagram show screenshots of dms
screenshot of instagram story,100,2,,Anonymous Viewing,Screenshot Privacy,TOF,"Ads, Own Tool","Informational,Branded,Non-local",Social networks,can you see if someone screenshots your instagram story
tiktok unblocked,24000,0,0.06,Anonymous Viewing,TikTok Access/Unblock,TOF,"Ads, Own Tool","Informational,Branded,Non-local",Social networks,tiktok unblocked
watch tiktok without app,8500,2,0.02,Anonymous Viewing,TikTok Access/Unblock,TOF,"Ads, Affiliate, Own Tool","Informational,Branded,Non-local",Online media; Online video,watch tiktok without app
unblocked tiktok,5900,0,0.1,Anonymous Viewing,TikTok Access/Unblock,TOF,"Ads, Own Tool","Informational,Branded,Non-local",Web services,tiktok unblocked
how to watch tiktok without app,5700,2,0.6,Anonymous Viewing,TikTok Access/Unblock,TOF,"Ads, Affiliate, Own Tool","Informational,Branded,Non-local",Online media; Online video,how to watch tiktok without app
how to watch a tiktok without the app,1300,1,1.6,Anonymous Viewing,TikTok Access/Unblock,TOF,"Ads, Affiliate, Own Tool","Informational,Branded,Non-local",Online media; Online video,how to watch tiktoks without the app
tiktok unblocked website,1200,0,0.09,Anonymous Viewing,TikTok Access/Unblock,TOF,"Ads, Own Tool","Informational,Branded,Non-local",Web services; Social networks,tiktok unblocked
can you watch tiktok without the app,900,1,0.25,Anonymous Viewing,TikTok Access/Unblock,TOF,"Ads, Affiliate, Own Tool","Informational,Branded,Non-local",Online media; Online video,tiktok online
view tiktok without app,900,2,35,Anonymous Viewing,TikTok Access/Unblock,TOF,"Ads, Affiliate, Own Tool","Informational,Non-branded,Non-local",Online media; Online video,watch tiktok without app
tiktok without app,800,16,0.35,Anonymous Viewing,TikTok Access/Unblock,TOF,"Ads, Affiliate, Own Tool","Informational,Branded,Non-local",Online media; Online video,watch tiktok without app
tiktok stories viewer,500,0,5,Anonymous Viewing,TikTok Access/Unblock,TOF,"Ads, Own Tool","Informational,Branded,Non-local",Sharing,tiktok viewer
how to watch tiktok without the app,500,4,1.3,Anonymous Viewing,TikTok Access/Unblock,TOF,"Ads, Affiliate, Own Tool","Informational,Branded,Non-local",Online media; Online video,how to watch tiktok without app
can i watch tiktok without the app,450,3,19,Anonymous Viewing,TikTok Access/Unblock,TOF,"Ads, Affiliate, Own Tool","Informational,Branded,Non-local",Online media; Online video,how to watch tiktok without app
how to view tiktok without app,450,4,25,Anonymous Viewing,TikTok Access/Unblock,TOF,"Ads, Affiliate, Own Tool","Informational,Branded,Non-local",Online media; Online video,how to watch tiktok without app
how to watch tiktok without an account,450,9,1.2,Anonymous Viewing,TikTok Access/Unblock,TOF,"Ads, Own Tool","Informational,Branded,Non-local",Online media,how to watch tiktok without app
play tiktok without app,400,5,20,Anonymous Viewing,TikTok Access/Unblock,TOF,"Ads, Affiliate, Own Tool","Informational,Branded,Non-local",Online media,tiktok viewer
how to watch tiktok videos without tiktok,400,13,1.4,Anonymous Viewing,TikTok Access/Unblock,TOF,"Ads, Own Tool","Informational,Branded,Non-local",Online media; Online video,tiktok viewer online
watch tiktok videos without app,350,0,0.7,Anonymous Viewing,TikTok Access/Unblock,TOF,"Ads, Affiliate, Own Tool","Informational,Non-branded,Non-local",Online media; Online video,how to watch tiktok without app
view tiktok without account,350,1,50,Anonymous Viewing,TikTok Access/Unblock,TOF,"Ads, Own Tool","Informational,Non-branded,Non-local",Online media; Online video,tiktok viewer
tiktok viewer free,350,18,0.8,Anonymous Viewing,TikTok Access/Unblock,TOF,"Ads, Own Tool","Informational,Branded,Non-local",Sharing,tiktok viewer
tiktok link viewer,250,15,,Anonymous Viewing,TikTok Access/Unblock,TOF,"Ads, Own Tool","Informational,Branded,Non-local",Online media; Online video,tiktok viewer
can you watch a tiktok without the app,200,0,,Anonymous Viewing,TikTok Access/Unblock,TOF,"Ads, Affiliate, Own Tool","Informational,Branded,Non-local",Online media,watch tiktok without app
watch tiktok in browser,200,0,,Anonymous Viewing,TikTok Access/Unblock,TOF,"Ads, Own Tool","Informational,Branded,Non-local",Online media,tiktok viewer
watch tiktok live anonymously,200,4,,Anonymous Viewing,TikTok Access/Unblock,TOF,"Ads, Affiliate (VPN), Own Tool","Informational,Branded,Non-local",Social networks,tiktok viewer
can you watch a tiktok without an account,200,6,,Anonymous Viewing,TikTok Access/Unblock,TOF,"Ads, Own Tool","Informational,Non-branded,Non-local",Online media,how to watch tiktok without app
how to use tiktok without app,200,13,,Anonymous Viewing,TikTok Access/Unblock,TOF,"Ads, Affiliate, Own Tool","Informational,Branded,Non-local",Sharing,tiktok viewer online
free tiktok view bot,150,0,0.5,Anonymous Viewing,TikTok Access/Unblock,BOF,Own Tool,"Informational,Branded,Non-local",Sharing,free tiktok views
open tiktok without app,150,1,1.1,Anonymous Viewing,TikTok Access/Unblock,TOF,"Ads, Affiliate, Own Tool","Informational,Branded,Non-local",Online media; Online video,watch tiktok without app
watch tiktok without app iphone,150,1,,Anonymous Viewing,TikTok Access/Unblock,TOF,"Ads, Affiliate, Own Tool","Informational,Branded,Non-local",Online media; Online video,how to watch tiktok without app
can i watch tiktok without an account,150,3,7,Anonymous Viewing,TikTok Access/Unblock,TOF,"Ads, Own Tool","Informational,Branded,Non-local",Online media,can you watch tiktok without an account
how to watch tiktok without account,150,5,0.2,Anonymous Viewing,TikTok Access/Unblock,TOF,"Ads, Own Tool","Informational,Branded,Non-local",Online media; Online video,how to watch tiktok without app
tiktok anonymously,150,9,6,Anonymous Viewing,TikTok Access/Unblock,TOF,"Ads, Affiliate (VPN), Own Tool","Informational,Branded,Non-local",Sharing,tiktok viewer
tiktok browser viewer,150,11,,Anonymous Viewing,TikTok Access/Unblock,TOF,"Ads, Own Tool","Informational,Branded,Non-local",Online media; Online video,watch tiktok without app
tiktok search without app,100,0,3.5,Anonymous Viewing,TikTok Access/Unblock,TOF,"Ads, Affiliate, Own Tool","Informational,Branded,Non-local",Online media; Online video,watch tiktok without app
tiktok viewer bot,100,0,0.6,Anonymous Viewing,TikTok Access/Unblock,MOF,Own Tool,"Informational,Commercial,Transactional,Branded,Non-local",Sharing,tiktok viewer bot
can you watch tiktok videos without the app,100,0,,Anonymous Viewing,TikTok Access/Unblock,TOF,"Ads, Affiliate, Own Tool","Informational,Branded,Non-local",Online media; Online video,how to watch tiktok without app
use tiktok without account,100,0,1,Anonymous Viewing,TikTok Access/Unblock,TOF,"Ads, Own Tool","Informational,Branded,Non-local",Sharing,can i watch tiktok without an account
can you view tiktok without an account,100,0,,Anonymous Viewing,TikTok Access/Unblock,TOF,"Ads, Own Tool","Informational,Branded,Non-local",Social networks,can i watch tiktok without an account
how can i watch tiktok without an account,100,0,,Anonymous Viewing,TikTok Access/Unblock,TOF,"Ads, Own Tool","Informational,Branded,Non-local",Online media; Online video,how to watch tiktok without app
watch tiktok videos without account,100,0,,Anonymous Viewing,TikTok Access/Unblock,TOF,"Ads, Own Tool","Informational,Non-branded,Non-local",Online media; Online video,watch tiktok without app
how to view tiktok without an account,100,0,6,Anonymous Viewing,TikTok Access/Unblock,TOF,"Ads, Own Tool","Informational,Branded,Non-local",Sharing,how to watch tiktok without app
how to watch tiktok on the app without an account,100,1,,Anonymous Viewing,TikTok Access/Unblock,TOF,"Ads, Affiliate, Own Tool","Informational,Branded,Non-local",Online media; Online video,tiktok viewer
watching tiktok without app,100,2,1.5,Anonymous Viewing,TikTok Access/Unblock,TOF,"Ads, Affiliate, Own Tool","Informational,Branded,Non-local",Online media; Online video,how to watch tiktok without app
tiktok live viewers bot,100,3,0.8,Anonymous Viewing,TikTok Access/Unblock,MOF,Own Tool,"Informational,Commercial,Transactional,Branded,Non-local",Social networks,tiktok live view bot
watch tiktok live without account,100,3,,Anonymous Viewing,TikTok Access/Unblock,TOF,"Ads, Own Tool","Informational,Branded,Non-local",Online media; Online video,can you watch tiktok live without an account
tiktok viewer without account,100,4,,Anonymous Viewing,TikTok Access/Unblock,TOF,"Ads, Own Tool","Informational,Non-branded,Non-local",Online media; Online video,tiktok viewer
third party tiktok viewer,100,17,,Anonymous Viewing,TikTok Access/Unblock,TOF,"Ads, Own Tool","Informational,Non-branded,Non-local",Online media,tiktok viewer
tiktok pfp viewer,300,5,,Anonymous Viewing,TikTok Profile Viewer,TOF,"Ads, Own Tool","Branded,Non-local",Image sharing,tiktok pfp downloader
tiktok profile picture viewer,250,2,,Anonymous Viewing,TikTok Profile Viewer,TOF,"Ads, Own Tool","Informational,Branded,Non-local",Online media,tiktok pfp
tiktok profile pic viewer,150,7,,Anonymous Viewing,TikTok Profile Viewer,TOF,"Ads, Own Tool","Informational,Branded,Non-local",Image sharing,tik tok viewer
tiktok story viewer,46000,0,5,Anonymous Viewing,TikTok Story Viewer,TOF,"Ads, Own Tool","Informational,Branded,Non-local",Sharing,tiktok viewer
anonymous tiktok story viewer,3300,7,,Anonymous Viewing,TikTok Story Viewer,TOF,"Ads, Affiliate (VPN), Own Tool","Informational,Branded,Non-local",Social networks,tiktok viewer
tiktok story viewer anonymous,2400,1,,Anonymous Viewing,TikTok Story Viewer,TOF,"Ads, Affiliate (VPN), Own Tool","Informational,Branded,Non-local",Social networks,tiktok viewer
tiktok anonymous story viewer,2100,1,,Anonymous Viewing,TikTok Story Viewer,TOF,"Ads, Affiliate (VPN), Own Tool","Informational,Branded,Non-local",Social networks,tiktok viewer
view tiktok story anonymously,2000,0,0.45,Anonymous Viewing,TikTok Story Viewer,TOF,"Ads, Affiliate (VPN), Own Tool","Informational,Branded,Non-local",Social networks,tiktok viewer
view tiktok story,600,6,5,Anonymous Viewing,TikTok Story Viewer,TOF,"Ads, Own Tool","Informational,Branded,Non-local",Social networks,tiktok viewer
watch deleted youtube videos,500,0,0.03,Anonymous Viewing,YouTube Deleted Videos,TOF,"Ads, Own Tool","Informational,Non-branded,Non-local",Online video,youtube video finder
how to watch hidden videos on youtube,150,0,,Anonymous Viewing,YouTube Deleted Videos,TOF,"Ads, Own Tool","Informational,Non-branded,Non-local",Online video,unavailable videos are hidden
view deleted youtube videos,150,3,0.03,Anonymous Viewing,YouTube Deleted Videos,TOF,"Ads, Own Tool","Informational,Non-branded,Non-local",Online video,youtube deleted video finder
instagram audio downloader,1900,5,0.09,Audio Conversion,Instagram Audio,BOF,"Affiliate, Own Tool","Informational,Branded,Non-local",Web services,instagram to mp3
youtube playlist to mp3,2100,1,0.08,Audio Conversion,Playlist to MP3,TOF,"Ads, Affiliate, Own Tool","Informational,Branded,Non-local",Web services,youtube playlist downloader
convert youtube playlist to mp3,250,0,0.7,Audio Conversion,Playlist to MP3,TOF,"Ads, Affiliate, Own Tool","Informational,Branded,Non-local",Multimedia,youtube playlist to mp3
convert youtube to ringtone,150,0,0.25,Audio Conversion,Ringtones,TOF,"Ads, Affiliate, Own Tool","Informational,Branded,Non-local",Music,youtube to ringtone
descargar audios de tiktok,500,3,0.9,Audio Conversion,TikTok Audio,TOF,"Ads, Affiliate, Own Tool","Informational,Branded,Non-local",Music,descargar tiktok mp3
tiktok audio finder,150,0,,Audio Conversion,TikTok Audio,BOF,"Affiliate, Own Tool","Informational,Branded,Non-local",Music,song finder by link
convertidor de tiktok a mp3,100,14,,Audio Conversion,TikTok Audio,TOF,"Ads, Affiliate, Own Tool","Informational,Branded,Non-local",Web services,descargar tiktok mp3
descargar musica de youtube gratis,600,0,0.2,Audio Conversion,YouTube MP3,TOF,"Ads, Affiliate, Own Tool","Informational,Non-branded,Non-local",Music streams,convertidor mp3
convertidor mp3 youtube,450,0,0.09,Audio Conversion,YouTube MP3,TOF,"Ads, Affiliate, Own Tool","Informational,Branded,Non-local",Web services,youtube to mp3
youtube thumbnail converter,350,12,0.35,Audio Conversion,YouTube MP3,BOF,"Affiliate, Own Tool","Informational,Non-branded,Non-local",Multimedia,youtube thumbnail size
youtube music premium mod apk with offline download,300,8,0.3,Audio Conversion,YouTube MP3,BOF,"Affiliate, Own Tool","Transactional,Branded,Non-local",Multimedia,youtube music premium apk
youtube mp3 downloader free,200,1,0.08,Audio Conversion,YouTube MP3,BOF,"Affiliate, Own Tool","Informational,Branded,Non-local",Web services,convert youtube to mp3
free youtube mp3,200,18,0.04,Audio Conversion,YouTube MP3,BOF,"Affiliate, Own Tool","Informational,Branded,Non-local",Web services,youtube to mp3
does youtube have audiobooks,150,1,0.2,Audio Conversion,YouTube MP3,TOF,"Ads, Affiliate, Own Tool","Informational,Branded,Non-local",Audiobooks,great audiobooks
youtube mp3 maker,150,2,0.3,Audio Conversion,YouTube MP3,TOF,"Ads, Affiliate, Own Tool","Informational,Branded,Non-local",Web services,youtube to mp3
youtube converter mo3,150,7,,Audio Conversion,YouTube MP3,BOF,"Affiliate, Own Tool","Informational,Non-branded,Non-local",Web services,ytmp3
youtube rip audio,150,7,0.25,Audio Conversion,YouTube MP3,TOF,"Ads, Affiliate, Own Tool","Informational,Branded,Non-local",Web services,youtube audio ripper
convert youtube to mp3 on mac,150,9,1.4,Audio Conversion,YouTube MP3,TOF,"Ads, Affiliate, Own Tool","Informational,Branded,Non-local",Multimedia,youtube to mp3 converter mac
convertidor de video youtube a mp3,150,17,0.5,Audio Conversion,YouTube MP3,TOF,"Ads, Affiliate, Own Tool","Navigational,Non-branded,Non-local",Web services,convertidor mp3
how to download beats from youtube,100,0,0.2,Audio Conversion,YouTube MP3,TOF,"Ads, Affiliate, Own Tool","Informational,Non-branded,Non-local",Music streams,how to download beats from youtube
descargar musica mp3 youtube,100,3,0.08,Audio Conversion,YouTube MP3,BOF,"Affiliate, Own Tool","Transactional,Branded,Non-local",Music streams,convertidor mp3
descargar musica youtube gratis,100,4,0.15,Audio Conversion,YouTube MP3,TOF,"Ads, Affiliate, Own Tool","Informational,Branded,Non-local",Music streams,convertidor mp3
download youtube music to computer mp3,100,11,1,Audio Conversion,YouTube MP3,TOF,"Ads, Affiliate, Own Tool","Informational,Branded,Non-local",Multimedia,youtube to mp3
youtube video to notes converter ai,100,11,0.7,Audio Conversion,YouTube MP3,BOF,"Affiliate, Own Tool","Informational,Non-branded,Non-local",Business; Educational,notegpt
convert tiktok to mp4,600,6,0.06,Audio Conversion,YouTube to MP4,TOF,"Ads, Affiliate, Own Tool","Informational,Branded,Non-local",Web services,tiktok downloader
youtube playlist to mp4,300,11,4.5,Audio Conversion,YouTube to MP4,TOF,"Ads, Affiliate, Own Tool","Informational,Branded,Non-local",Web services,download youtube playlist reddit
tiktok video to mp4,150,9,,Audio Conversion,YouTube to MP4,TOF,"Ads, Affiliate, Own Tool","Non-branded,Non-local",Web services,tiktok to mp4
youtube to ogg,4900,1,0.03,Audio Conversion,YouTube to OGG,TOF,"Ads, Affiliate, Own Tool","Informational,Branded,Non-local",Web services,youtube ogg
youtube to ogg converter,450,0,0.04,Audio Conversion,YouTube to OGG,BOF,"Affiliate, Own Tool","Informational,Non-branded,Non-local",Utilities,youtube to ogg
best travel vloggers on youtube,100,0,,Audio Conversion,YouTube to OGG,MOF,"Affiliate, Own Tool","Informational,Non-branded,Non-local",Online video,travel youtubers
youtube to .ogg,100,0,0.07,Audio Conversion,YouTube to OGG,TOF,"Ads, Affiliate, Own Tool","Informational,Branded,Non-local",Web services,youtube to ogg
youtube ogg,100,0,0.03,Audio Conversion,YouTube to OGG,TOF,"Ads, Affiliate, Own Tool","Informational,Branded,Non-local",Web services,youtube to ogg cloudconvert
best youtube travel vloggers,100,1,0.04,Audio Conversion,YouTube to OGG,MOF,"Affiliate, Own Tool","Informational,Branded,Non-local",Online video,best travel vloggers
youtube to wav,55000,1,0.04,Audio Conversion,YouTube to WAV,TOF,"Ads, Affiliate, Own Tool","Informational,Branded,Non-local",Multimedia,youtube to wav
youtube to wav converter,4800,0,0.07,Audio Conversion,YouTube to WAV,BOF,"Affiliate, Own Tool","Informational,Non-branded,Non-local",Multimedia,youtube to wav
youtube wav,2400,1,0.04,Audio Conversion,YouTube to WAV,TOF,"Ads, Affiliate, Own Tool","Informational,Branded,Non-local",Web services,youtube to wav
youtube to wave,900,0,0.04,Audio Conversion,YouTube to WAV,TOF,"Ads, Affiliate, Own Tool","Informational,Branded,Non-local",Multimedia,youtube to wav
convert youtube to wav,900,2,0.1,Audio Conversion,YouTube to WAV,TOF,"Ads, Affiliate, Own Tool","Informational,Branded,Non-local",Web services,youtube to wav
youtube to .wav,800,1,0.04,Audio Conversion,YouTube to WAV,TOF,"Ads, Affiliate, Own Tool","Informational,Branded,Non-local",Web services,youtube to wav
youtube wav converter,800,6,0.06,Audio Conversion,YouTube to WAV,BOF,"Affiliate, Own Tool","Informational,Branded,Non-local",Multimedia,yotube to wav
youtube converter wav,700,2,0.05,Audio Conversion,YouTube to WAV,BOF,"Affiliate, Own Tool","Informational,Non-branded,Non-local",Multimedia,youtube to wav converter
youtube 2 wav,250,1,,Audio Conversion,YouTube to WAV,TOF,"Ads, Affiliate, Own Tool","Informational,Branded,Non-local",Multimedia,yt to wav
youtube mp3 converter wav,150,3,,Audio Conversion,YouTube to WAV,BOF,"Affiliate, Own Tool","Informational,Branded,Non-local",/Other,yt to mp3 converter --
instagram to wav,150,9,,Audio Conversion,YouTube to WAV,TOF,"Ads, Affiliate, Own Tool","Branded,Non-local",Web services,instagram to mp3
youtube to wav convert,100,0,0.8,Audio Conversion,YouTube to WAV,TOF,"Ads, Affiliate, Own Tool","Informational,Non-branded,Non-local",Web services,yt to wav
youtube to .wav converter,100,0,,Audio Conversion,YouTube to WAV,BOF,"Affiliate, Own Tool","Informational,Non-branded,Non-local",Web services,yt to wav
youtube to wav.,100,1,,Audio Conversion,YouTube to WAV,TOF,"Ads, Affiliate, Own Tool","Informational,Branded,Non-local",Web services,yt to wav
convertidor de youtube a wav,100,1,,Audio Conversion,YouTube to WAV,TOF,"Ads, Affiliate, Own Tool","Informational,Non-branded,Non-local",Web services,youtube to wav converter
youtube to wav safe,100,1,,Audio Conversion,YouTube to WAV,TOF,"Ads, Affiliate, Affiliate (VPN), Own Tool","Informational,Non-branded,Non-local",Multimedia,youtube to wav converter
youtube to wmv,150,10,0.9,Audio Conversion,YouTube to WMV,TOF,"Ads, Affiliate, Own Tool","Informational,Branded,Non-local",Multimedia,youtube to wmv
youtube to webm,1000,0,0.1,Audio Conversion,YouTube to WebM,TOF,"Ads, Affiliate, Own Tool","Informational,Branded,Non-local",Web services,youtube to webm
smile quotes for instagram,1100,3,0.01,Creator Assets,Captions & Bios,TOF,"Ads, Digital Product","Informational,Non-branded,Non-local",Trivia,smile quotes
engagement instagram captions,500,0,0.01,Creator Assets,Captions & Bios,TOF,"Ads, Digital Product","Informational,Non-branded,Non-local",Social networks,engagement instagram captions
engagement captions for instagram,500,0,0.01,Creator Assets,Captions & Bios,TOF,"Ads, Digital Product","Informational,Non-branded,Non-local",Social networks,engagement captions
unique engagement captions for instagram,500,0,0.02,Creator Assets,Captions & Bios,TOF,"Ads, Digital Product","Informational,Non-branded,Non-local",Social networks,engagement captions
bachelorette instagram captions,400,0,0.01,Creator Assets,Captions & Bios,TOF,"Ads, Digital Product","Informational,Non-branded,Non-local",Social networks,bachelorette instagram captions
flower captions for instagram,400,0,0.01,Creator Assets,Captions & Bios,TOF,"Ads, Digital Product","Informational,Non-branded,Non-local",Entertainment,flower captions for instagram
pumpkin patch instagram captions,350,0,0.02,Creator Assets,Captions & Bios,TOF,"Ads, Digital Product","Informational,Non-branded,Non-local",Social networks,pumpkin patch captions instagram
flower quotes for instagram,350,0,0.02,Creator Assets,Captions & Bios,TOF,"Ads, Digital Product","Informational,Non-branded,Non-local",Entertainment,flower quotes for instagram
