Keyword,Volume,KD,CPC,Pillar,Cluster,Funnel Stage,Monetization,Intent,Category,Parent Keyword
find who doesn't follow you back on instagram,150,19,,Social Media Tools,Follower Tracking,TOF,Ads,"Informational,Branded,Non-local",Social networks,how to see who doesn't follow you back on instagram
how to check who isn't following you back on instagram,100,4,0.7,Social Media Tools,Follower Tracking,TOF,Ads,"Informational,Branded,Non-local",Social networks,how to see who doesn't follow you back on instagram
how to know who follows you back on instagram,100,6,0.6,Social Media Tools,Follower Tracking,TOF,Ads,"Informational,Branded,Non-local",Social networks,how to see who doesn't follow you back on instagram
how to see who doesnt follow you on instagram,100,10,0.6,Social Media Tools,Follower Tracking,TOF,Ads,"Informational,Branded,Non-local",Social networks,how to see who doesn't follow you back on instagram
accounts that don't follow me back instagram,100,10,0.6,Social Media Tools,Follower Tracking,TOF,Ads,"Informational,Branded,Non-local",Social networks,how to see who doesn't follow you back on instagram
who follows me back on instagram,100,12,0.8,Social Media Tools,Follower Tracking,TOF,Ads,"Informational,Branded,Non-local",Social networks,how to see who doesn't follow you back on instagram
instagram chronological order following,100,14,,Social Media Tools,Follower Tracking,TOF,Ads,"Informational,Branded,Non-local",Social networks,how to see someone's instagram followers in chronological order
check who follows you back on instagram,100,17,,Social Media Tools,Follower Tracking,TOF,Ads,"Informational,Branded,Non-local",Social networks,how to see who doesn't follow you back on instagram
who isn't following me back on instagram,100,18,0.4,Social Media Tools,Follower Tracking,TOF,Ads,"Informational,Branded,Non-local",Social networks,how to see who doesn't follow you back on instagram
instagram unfollowers check,100,20,0.6,Social Media Tools,Follower Tracking,TOF,Ads,"Informational,Branded,Non-local",Social networks,unfollowers tracker
instagram search queries optimization,5400,0,,Social Media Tools,General,TOF,Ads,"Informational,Non-branded,Non-local",Social networks,instagram search query optimization
tiktok user finder,1500,8,1.3,Social Media Tools,General,BOF,Ads,"Informational,Branded,Non-local",Social networks,find tiktok user
youtube cutter,1100,8,0.9,Social Media Tools,General,BOF,Ads,"Informational,Branded,Non-local",Multimedia,youtube to mp4 trim
tiktok finder,1000,10,0.8,Social Media Tools,General,BOF,Ads,"Informational,Branded,Non-local",Social networks,tiktok user finder
tiktok verification,800,1,1.2,Social Media Tools,General,TOF,Ads,"Informational,Branded,Non-local",Social networks,verification@tiktok.com
deleted youtube videos finder,700,0,1.3,Social Media Tools,General,BOF,Ads,"Informational,Non-branded,Non-local",Online video,youtube video finder
tiktok account finder,700,2,1.5,Social Media Tools,General,BOF,Ads,"Informational,Non-branded,Non-local",Social networks,tiktok user finder
youtube advanced search,600,14,0.04,Social Media Tools,General,TOF,Ads,"Informational,Branded,Non-local",SEO and marketing,youtube advanced search
instagram carousel splitter,500,1,1.1,Social Media Tools,General,TOF,Ads,"Informational,Branded,Non-local",Social networks,my social boutique
most searched keywords on youtube 2017,500,5,,Social Media Tools,General,TOF,Ads,"Informational,Non-branded,Non-local",Online media,most searched keywords on youtube 2017
deleted youtube video finder,450,0,0.15,Social Media Tools,General,BOF,Ads,"Informational,Non-branded,Non-local",Online video,youtube video finder
youtube deleted video finder,350,0,0.15,Social Media Tools,General,BOF,Ads,"Informational,Branded,Non-local",/Other,youtube video finder
tiktok lookup,350,8,1.9,Social Media Tools,General,TOF,Ads,"Informational,Branded,Non-local",Social networks,tiktok finder
tiktok account lookup,300,5,1.6,Social Media Tools,General,TOF,Ads,"Informational,Non-branded,Non-local",Social networks,tiktok user search
deleted video finder for youtube,250,1,,Social Media Tools,General,BOF,Ads,"Informational,Non-branded,Non-local",Web services,youtube video finder
youtube niche finder,250,2,1.1,Social Media Tools,General,BOF,Ads,"Informational,Non-branded,Non-local",Brand; Marketing,youtube niche finder
youtube word search,200,0,0.05,Social Media Tools,General,TOF,Ads,"Informational,Branded,Non-local",/Other,filmot
tiktok account creation date finder,200,0,1.7,Social Media Tools,General,BOF,Ads,"Informational,Non-branded,Non-local",Social networks,tiktok account creation date
facebook email finder,200,3,1.1,Social Media Tools,General,BOF,Ads,"Informational,Branded,Non-local",Email; Social networks,facebook email finder
instagram email finder online free,200,5,1.1,Social Media Tools,General,BOF,Ads,"Informational,Non-branded,Non-local",Social networks,instagram email finder online free
facebook video search engine,150,0,,Social Media Tools,General,TOF,Ads,"Informational,Branded,Non-local",Search engines,facebook video search engine
tiktok creation date,150,0,,Social Media Tools,General,TOF,Ads,"Informational,Branded,Non-local",Social networks,tiktok account age checker
tiktok video search engine,150,0,,Social Media Tools,General,TOF,Ads,"Informational,Branded,Non-local",Online media; Online video; Search engines,tiktok video finder
tiktok user search engine,150,1,0.25,Social Media Tools,General,TOF,Ads,"Informational,Branded,Non-local",Social networks,tiktok user finder
youtube key finder,150,3,,Social Media Tools,General,BOF,Ads,"Informational,Branded,Non-local",Utilities,youtube key finder
instagram email finder tools,150,9,0.7,Social Media Tools,General,BOF,Affiliate,"Informational,Non-branded,Non-local",Social networks,instagram email finder
how to search all of facebook marketplace,150,14,,Social Media Tools,General,TOF,Ads,"Informational,Branded,Non-local",Classifieds,searchtempest
split image for instagram,150,18,0.3,Social Media Tools,General,TOF,Ads,"Informational,Non-branded,Non-local",Entertainment,image splitter
similar youtube channel finder,100,0,,Social Media Tools,General,BOF,Ads,"Informational,Non-branded,Non-local",Online media,find similar youtube channels
tiktok account age checker,100,0,,Social Media Tools,General,BOF,Ads,"Informational,Non-branded,Non-local",Social networks,tik tok creation date
youtube channel ranking checker,100,9,,Social Media Tools,General,BOF,Ads,"Informational,Non-branded,Non-local",Online media,website rank checker
can you see who shared your instagram post,5200,0,0.15,Social Media Tools,Instagram Tools,TOF,Ads,"Informational,Non-branded,Non-local",Social networks,can you see who sent your instagram post
short instagram video nyt,700,0,,Social Media Tools,Instagram Tools,TOF,Ads,"Informational,Branded,Non-local",Communities,short instagram video crossword
can you see who shared your post on instagram,600,0,,Social Media Tools,Instagram Tools,TOF,Ads,"Informational,Branded,Non-local",Social networks,can you see who shared your instagram post
discord instagram embed,600,0,,Social Media Tools,Instagram Tools,TOF,Ads,"Informational,Branded,Non-local",Social networks,instagram embed discord
bible verses for instagram bio,500,0,0.15,Social Media Tools,Instagram Tools,TOF,Ads,"Informational,Non-branded,Non-local",Belief,bible verses for instagram bio
instagram photo editing apps,500,7,1.2,Social Media Tools,Instagram Tools,MOF,Affiliate,"Informational,Commercial,Branded,Non-local",Entertainment,instagram photo editing apps
blank space for instagram highlights,450,0,5,Social Media Tools,Instagram Tools,TOF,Ads,"Informational,Branded,Non-local",Social networks,blank highlight name
how to turn off instagram read receipts,450,0,,Social Media Tools,Instagram Tools,TOF,Ads,"Informational,Branded,Non-local",Social networks,how to turn off read receipts on instagram
gb instagram,450,2,3.5,Social Media Tools,Instagram Tools,TOF,Ads,"Informational,Branded,Non-local",Social networks,gb instagram
follow for follow instagram,400,0,0.9,Social Media Tools,Instagram Tools,TOF,Ads,"Informational,Branded,Non-local",Social networks,reddit instagram follow for follow
pixwox instagram,400,1,0.9,Social Media Tools,Instagram Tools,TOF,Ads,"Informational,Branded,Non-local",Hosting,pixwox
how to grow your photography instagram,300,0,0.03,Social Media Tools,Instagram Tools,TOF,Ads,"Informational,Branded,Non-local",Image sharing,how to grow photography instagram
blank highlight instagram,250,0,5,Social Media Tools,Instagram Tools,TOF,Ads,"Informational,Branded,Non-local",Social networks,blank highlight name
should i delete instagram,250,0,0.05,Social Media Tools,Instagram Tools,TOF,Ads,"Informational,Branded,Non-local",Social networks,should i delete instagram
how to see who shared your reel on instagram,250,0,0.2,Social Media Tools,Instagram Tools,TOF,Ads,"Informational,Branded,Non-local",Social networks,how to see who shared your reel on instagram
things to post on instagram,250,0,0.8,Social Media Tools,Instagram Tools,TOF,Ads,"Informational,Branded,Non-local",Image sharing; Sharing,what to post on instagram
instagram live archive,250,1,1,Social Media Tools,Instagram Tools,TOF,Ads,"Informational,Branded,Non-local",Social networks,instagram live archive
how to see if someone follows you back on instagram,250,1,0.5,Social Media Tools,Instagram Tools,TOF,Ads,"Informational,Branded,Non-local",Social networks,how to see who doesn't follow you back on instagram
instagram posts ideas,200,0,0.45,Social Media Tools,Instagram Tools,TOF,Ads,"Informational,Non-branded,Non-local",Social networks,instagram post ideas
instagram consultant,200,0,2.5,Social Media Tools,Instagram Tools,MOF,Ads,"Informational,Commercial,Non-branded,Non-local",Consulting,instagram consultant
instagram reklam fiyatları,200,0,,Social Media Tools,Instagram Tools,MOF,Ads,"Informational,Commercial,Branded,Non-local",Marketing,instagram reklam verme
instagram user slangily,200,0,,Social Media Tools,Instagram Tools,TOF,Ads,"Informational,Non-branded,Non-local",Social networks,instagrammer slangily
agencia instagram ads,200,0,,Social Media Tools,Instagram Tools,MOF,Ads,"Informational,Commercial,Branded,Non-local",Marketing,agencia instagram ads
how to see who shared your posts on instagram,200,1,0.1,Social Media Tools,Instagram Tools,TOF,Ads,"Informational,Branded,Non-local",Social networks,can you see who shares your post on instagram
how to make photos fit on instagram,200,2,0.9,Social Media Tools,Instagram Tools,TOF,Ads,"Informational,Branded,Non-local",Video,how to make pictures fit on instagram
follows back instagram,200,4,,Social Media Tools,Instagram Tools,TOF,Ads,"Informational,Branded,Non-local",Social networks,follows back
picku instagram,200,17,,Social Media Tools,Instagram Tools,TOF,Ads,"Informational,Branded,Non-local",Social networks,picuki
followsback instagram,150,0,1.6,Social Media Tools,Instagram Tools,TOF,Ads,"Informational,Branded,Non-local",Social networks,followsback
instagram saves buy,150,0,3,Social Media Tools,Instagram Tools,BOF,Ads,"Commercial,Transactional,Non-branded,Non-local",Social networks,buy instagram saves
cuando se creo instagram,150,0,,Social Media Tools,Instagram Tools,TOF,Ads,"Informational,Branded,Non-local",Social networks,que es ig
instagram rocket ipa,150,0,,Social Media Tools,Instagram Tools,TOF,Ads,"Informational,Branded,Non-local",Utilities,rocket for instagram
instagram follow for follow,150,0,0.9,Social Media Tools,Instagram Tools,TOF,Ads,"Informational,Branded,Non-local",Social networks,instagram follow
jasa kelola instagram,150,0,,Social Media Tools,Instagram Tools,MOF,Ads,"Informational,Commercial,Branded,Non-local",Social networks,jasa kelola instagram
instagram rocket,150,0,0.9,Social Media Tools,Instagram Tools,TOF,Ads,"Informational,Branded,Non-local",Image sharing; Sharing,instagram rocket ipa
accidentally followed someone on instagram,150,0,,Social Media Tools,Instagram Tools,TOF,Ads,"Informational,Branded,Non-local",Social networks,if you follow someone on instagram and immediately unfollow
how to build a following on instagram,150,0,0.08,Social Media Tools,Instagram Tools,TOF,Ads,"Informational,Branded,Non-local",Social networks,how to create a following on instagram
instagram decal,150,0,0.45,Social Media Tools,Instagram Tools,BOF,Ads,"Commercial,Transactional,Branded,Non-local",Personalized items,custom instagram stickers
cobanov dev instagram,150,0,,Social Media Tools,Instagram Tools,TOF,Ads,"Informational,Branded,Non-local",Utilities; Social networks,github instagram unfollowers
can you see who shared your reel on instagram,150,0,,Social Media Tools,Instagram Tools,TOF,Ads,"Informational,Branded,Non-local",Social networks,can you see who shared your instagram post
instagram highlight blank,150,0,,Social Media Tools,Instagram Tools,TOF,Ads,"Informational,Branded,Non-local",Social networks,blank space copy and paste
blank highlight name instagram,150,0,,Social Media Tools,Instagram Tools,TOF,Ads,"Informational,Branded,Non-local",Social networks,blank space copy and paste
photo editing apps for instagram,150,0,0.6,Social Media Tools,Instagram Tools,MOF,Affiliate,"Informational,Commercial,Non-branded,Non-local",Multimedia,photo editor instagram
discord embed instagram,150,0,,Social Media Tools,Instagram Tools,TOF,Ads,"Informational,Branded,Non-local",Social networks,instagram embed discord
instagram without reels,150,0,,Social Media Tools,Instagram Tools,TOF,Ads,"Informational,Branded,Non-local",Social networks,how to disable instagram reels reddit
how to crop photos for instagram,150,0,0.7,Social Media Tools,Instagram Tools,TOF,Ads,"Informational,Branded,Non-local",Video,how to crop photos for instagram
most followed nba players on instagram,150,0,,Social Media Tools,Instagram Tools,TOF,Ads,"Informational,Non-branded,Non-local",Sports fan gear,most followed nba players on instagram
tulum instagram spots,150,0,,Social Media Tools,Instagram Tools,TOF,Ads,"Informational,Non-branded,Local",Islands,tulum swing
jasa iklan instagram,150,0,,Social Media Tools,Instagram Tools,MOF,Ads,"Informational,Commercial,Branded,Non-local",Marketing,jasa iklan facebook
best photo editing apps for instagram,150,1,1.6,Social Media Tools,Instagram Tools,MOF,Affiliate,"Informational,Commercial,Non-branded,Non-local",Entertainment,best photo editing apps
nitreo instagram,150,1,1.2,Social Media Tools,Instagram Tools,MOF,Ads,"Informational,Commercial,Branded,Non-local",Social networks,nitreo
instagram tools free,150,1,1.1,Social Media Tools,Instagram Tools,TOF,"Ads, Affiliate","Informational,Non-branded,Non-local",Social networks,instagram growth tools
how to see when instagram account was created,150,1,,Social Media Tools,Instagram Tools,TOF,Ads,"Informational,Non-branded,Non-local",Social networks,how to see when instagram account was created
how to tag someone on instagram after posting,150,1,,Social Media Tools,Instagram Tools,TOF,Ads,"Informational,Branded,Non-local",Social networks,how to tag someone on instagram
best app for instagram posts,150,1,1.5,Social Media Tools,Instagram Tools,MOF,Affiliate,"Informational,Commercial,Non-branded,Non-local",Online media,instagram collage maker
how to make instagram pictures fit,150,3,0.9,Social Media Tools,Instagram Tools,TOF,Ads,"Informational,Non-branded,Non-local",Social networks,how to make pictures fit on instagram
instagram live replay,150,3,,Social Media Tools,Instagram Tools,TOF,Ads,"Informational,Branded,Non-local",Social networks,instagram live replay
instagram profile mockup generator,150,3,1.1,Social Media Tools,Instagram Tools,BOF,Ads,"Informational,Non-branded,Non-local",Online goodies,instagram account template
instagram dump,150,4,,Social Media Tools,Instagram Tools,TOF,Ads,"Informational,Branded,Non-local",Hosting,instagram dump
how to make a good instagram post,150,5,0.8,Social Media Tools,Instagram Tools,TOF,Ads,"Informational,Non-branded,Non-local",Social networks,how to make a good instagram post
picuki.com instagram,150,6,,Social Media Tools,Instagram Tools,TOF,Ads,"Informational,Branded,Non-local",Image sharing,instagram viewer
comprar me gusta instagram,150,9,1.6,Social Media Tools,Instagram Tools,BOF,Ads,"Commercial,Transactional,Branded,Non-local",Social networks,comprar seguidores baratos instagram
instagram profile zoom,150,10,,Social Media Tools,Instagram Tools,TOF,Ads,"Informational,Non-branded,Non-local",Social networks,instadp
bots para instagram,150,16,0.5,Social Media Tools,Instagram Tools,TOF,Ads,"Informational,Branded,Non-local",Social networks,bothelp
pinterest vs instagram,100,0,,Social Media Tools,Instagram Tools,MOF,Ads,"Informational,Branded,Non-local",Social networks,pinterest vs instagram
how to see when an instagram account was made,100,0,,Social Media Tools,Instagram Tools,TOF,Ads,"Informational,Non-branded,Non-local",Social networks,how to see when instagram account was created
instagram sticker for car,100,0,0.5,Social Media Tools,Instagram Tools,BOF,Ads,"Commercial,Transactional,Branded,Non-local",Personalized items,instagram sticker for car
how to check when instagram account was created,100,0,,Social Media Tools,Instagram Tools,TOF,Ads,"Informational,Non-branded,Non-local",Social networks,how to see when you joined instagram
best app to post on instagram,100,0,0,Social Media Tools,Instagram Tools,MOF,Affiliate,"Informational,Commercial,Branded,Non-local",Social networks,best apps for instagram
top instagram apps,100,0,1,Social Media Tools,Instagram Tools,MOF,Affiliate,"Informational,Branded,Non-local",Social networks,best apps for instagram
instagram photo dump,100,0,,Social Media Tools,Instagram Tools,TOF,Ads,"Informational,Branded,Non-local",Image sharing,instagram dump
instagram car decal,100,0,0.5,Social Media Tools,Instagram Tools,BOF,Ads,"Commercial,Transactional,Branded,Non-local",Personalized items,instagram car stickers
how can i see who shared my reel on instagram,100,0,,Social Media Tools,Instagram Tools,TOF,Ads,"Informational,Branded,Non-local",Social networks,how to see who shared your instagram post
distraction free instagram,100,0,,Social Media Tools,Instagram Tools,BOF,Ads,"Informational,Branded,Non-local",Social networks,distraction free instagram
why does instagram zoom in on photos,100,0,,Social Media Tools,Instagram Tools,TOF,Ads,"Informational,Branded,Non-local",Image sharing,why does instagram zoom in on photos
best apps for instagram,100,0,1.2,Social Media Tools,Instagram Tools,MOF,Affiliate,"Informational,Branded,Non-local",Online media,apps for instagram
how to enter on instagram post,100,0,,Social Media Tools,Instagram Tools,TOF,Ads,"Informational,Non-branded,Non-local",Social networks,how to return on instagram bio
florence instagram spots,100,0,,Social Media Tools,Instagram Tools,TOF,Ads,"Informational,Non-branded,Local",Buildings,florence instagram spots
instagram ++ ipa,100,0,,Social Media Tools,Instagram Tools,BOF,Ads,"Transactional,Branded,Non-local",Add-ons,instagram ++ ipa
how to add text to instagram post,100,1,,Social Media Tools,Instagram Tools,TOF,Ads,"Informational,Non-branded,Non-local",Social networks,how to add text to instagram post
transcribe instagram reels,100,1,1.1,Social Media Tools,Instagram Tools,TOF,Ads,"Informational,Branded,Non-local",Web services,instagram transcript
photographers on instagram,100,1,0.06,Social Media Tools,Instagram Tools,TOF,Ads,"Informational,Non-branded,Non-local",Digital arts,best photographers on instagram
how to make picture fit instagram,100,2,0.2,Social Media Tools,Instagram Tools,TOF,Ads,"Informational,Branded,Non-local",Online media,how to make pictures fit on instagram
how to get deactivated instagram account back,100,3,,Social Media Tools,Instagram Tools,TOF,Ads,"Informational,Non-branded,Non-local",Social networks,how to reactivate instagram
can you get a disabled instagram account back,100,5,,Social Media Tools,Instagram Tools,TOF,Ads,"Informational,Non-branded,Non-local",Social networks,instagram account disabled
embed instagram feed wordpress,100,5,1.3,Social Media Tools,Instagram Tools,TOF,Ads,"Informational,Branded,Non-local",Internet; Blogging resources,how to embed instagram on wordpress
quien creo instagram,100,6,,Social Media Tools,Instagram Tools,TOF,Ads,"Informational,Branded,Non-local",Social networks,que es ig
how do u tag someone on instagram,100,7,0.06,Social Media Tools,Instagram Tools,TOF,Ads,"Informational,Branded,Non-local",Social networks,how to tag people on instagram
cheap instagram accounts,100,8,0.5,Social Media Tools,Instagram Tools,BOF,Ads,"Informational,Commercial,Transactional,Non-branded,Non-local",Social networks,buy instagram accounts
how to see who someone most recently followed on instagram,100,11,,Social Media Tools,Instagram Tools,TOF,Ads,"Informational,Branded,Non-local",Social networks,recent follow
buying instagram account,100,11,0,Social Media Tools,Instagram Tools,BOF,Ads,"Commercial,Transactional,Non-branded,Non-local",Social networks,buy instagram account
instagram call to action examples,100,12,0.8,Social Media Tools,Instagram Tools,TOF,Ads,"Informational,Branded,Non-local",Social networks,instagram call to action examples
how to make good instagram posts,100,12,1.2,Social Media Tools,Instagram Tools,TOF,Ads,"Informational,Non-branded,Non-local",Social networks,how to make a good instagram post
tiktok reverse image search,200,0,0.6,Social Media Tools,Reverse Search,TOF,Ads,"Informational,Branded,Non-local",Sharing,tiktok reverse search
tiktok shadow ban checker,350,0,0.2,Social Media Tools,Shadowban Detection,BOF,Ads,"Informational,Branded,Non-local",Social networks,tiktok shadow ban
tiktok shadowbanned checker,250,0,0.2,Social Media Tools,Shadowban Detection,BOF,Ads,"Informational,Branded,Non-local",Social networks,tiktok shadowbanned checker
shadowbanned tiktok,250,0,0.02,Social Media Tools,Shadowban Detection,TOF,Ads,"Informational,Branded,Non-local",Social networks,tiktok shadow ban checker
tiktok shadowban checker,150,1,0.15,Social Media Tools,Shadowban Detection,BOF,Ads,"Informational,Branded,Non-local",Social networks,instagram shadowban test
is my tiktok shadowbanned,150,1,0.3,Social Media Tools,Shadowban Detection,TOF,Ads,"Informational,Branded,Non-local",Social networks,instagram shadowban test
tiktok shadow ban checker and remover,150,1,0.25,Social Media Tools,Shadowban Detection,BOF,Ads,"Informational,Branded,Non-local",Social networks,shadowbanned tiktok
shadowban tiktok,150,3,0.02,Social Media Tools,Shadowban Detection,TOF,Ads,"Informational,Branded,Non-local",Social networks,shadowbanned tiktok
tiktok shadowbanned,100,0,0.02,Social Media Tools,Shadowban Detection,TOF,Ads,"Informational,Branded,Non-local",Social networks,how to get unshadowbanned on tiktok
youtube song finder,500,14,0.1,Social Media Tools,Song Identification,BOF,Ads,"Informational,Branded,Non-local",Music,song finder
tiktok song finder,350,0,0.3,Social Media Tools,Song Identification,BOF,Ads,"Informational,Branded,Non-local",Music,song finder by link
youtube bpm finder,250,15,0.15,Social Media Tools,Song Identification,BOF,Ads,"Informational,Branded,Non-local",Music,bpm finder
bpm finder youtube,200,5,0.15,Social Media Tools,Song Identification,BOF,Ads,"Informational,Branded,Non-local",Music,bpm finder youtube
youtube to bpm,150,3,,Social Media Tools,Song Identification,TOF,Ads,"Informational,Branded,Non-local",Music,bpm finder youtube
instagram song finder,150,14,,Social Media Tools,Song Identification,BOF,Ads,"Informational,Branded,Non-local",Music,song finder by video link
song finder from youtube video,100,12,,Social Media Tools,Song Identification,BOF,Ads,"Informational,Non-branded,Non-local",Music,song finder
tiktok candy,2500,0,0.15,Social Media Tools,TikTok Tools,MOF,Ads,"Informational,Commercial,Transactional,Branded,Non-local",Shopping portals,tiktok candy
tiktok browser,1600,16,0.08,Social Media Tools,TikTok Tools,TOF,Ads,"Informational,Branded,Non-local",Social networks,tiktok
tiktok live recorder,1000,6,1.9,Social Media Tools,TikTok Tools,TOF,Ads,"Informational,Branded,Non-local",Online media; Online video,tiktok live recorder
how long can a tiktok video be,900,5,0.1,Social Media Tools,TikTok Tools,TOF,Ads,"Informational,Non-branded,Non-local",Online video,how long can a tiktok be
tiktok database,700,0,,Social Media Tools,TikTok Tools,TOF,Ads,"Informational,Branded,Non-local",Data,tiktok analytics
invisible tiktok name copy and paste,500,0,,Social Media Tools,TikTok Tools,TOF,Ads,"Informational,Non-branded,Non-local",Social networks,invisible username tiktok
tiktok watcher,500,3,0.2,Social Media Tools,TikTok Tools,TOF,Ads,"Informational,Branded,Non-local",Social networks,watch tiktok without app
tiktok mod cloud,300,13,2.5,Social Media Tools,TikTok Tools,TOF,Ads,"Informational,Branded,Non-local",Social networks,tiktokmodcloud
tiktok oa,250,0,,Social Media Tools,TikTok Tools,TOF,Ads,"Informational,Branded,Non-local",Planning,tiktok oa
tiktok faces,250,0,0.1,Social Media Tools,TikTok Tools,TOF,Ads,"Informational,Branded,Non-local",Online video,tiktok faces
free tiktok saves,250,1,1.1,Social Media Tools,TikTok Tools,BOF,Ads,"Informational,Branded,Non-local",Online media; Online video,free tiktok saves
shadow ban tiktok,250,2,0.01,Social Media Tools,TikTok Tools,TOF,Ads,"Informational,Branded,Non-local",Social networks,shadowbanned tiktok
letras para tiktok,250,3,0.01,Social Media Tools,TikTok Tools,TOF,Ads,"Informational,Branded,Non-local",Online media,nombres para tik tok
free tiktok accounts,250,4,0.8,Social Media Tools,TikTok Tools,BOF,Ads,"Informational,Non-branded,Non-local",Social networks,tiktok business account
tiktok green goddess salad,200,0,0.02,Social Media Tools,TikTok Tools,TOF,Ads,"Informational,Branded,Non-local",Salads,green goddess salad
