Keyword,Volume,KD,CPC,Pillar,Cluster,Funnel Stage,Monetization,Intent,Category,Parent Keyword
flower instagram captions,300,0,0.01,Creator Assets,Captions & Bios,TOF,"Ads, Digital Product","Informational,Non-branded,Non-local",Social networks,flower instagram captions
instagram flower quotes,300,1,0.01,Creator Assets,Captions & Bios,TOF,"Ads, Digital Product","Informational,Branded,Non-local",Online media,flower captions for instagram
bridal shower instagram captions,250,0,0.06,Creator Assets,Captions & Bios,TOF,"Ads, Digital Product","Informational,Non-branded,Non-local",Entertainment,bridal shower captions
pumpkin quotes for instagram,200,0,0.02,Creator Assets,Captions & Bios,TOF,"Ads, Digital Product","Informational,Branded,Non-local",Online media,pumpkin quotes for instagram
short flower captions for instagram,200,0,,Creator Assets,Captions & Bios,TOF,"Ads, Digital Product","Informational,Non-branded,Non-local",Entertainment,flower instagram captions
21st birthday instagram captions,200,0,0.01,Creator Assets,Captions & Bios,TOF,"Ads, Digital Product","Informational,Non-branded,Non-local",Social networks,21st birthday captions
saree captions for instagram,200,1,,Creator Assets,Captions & Bios,TOF,"Ads, Digital Product","Informational,Non-branded,Non-local",Entertainment,saree captions for instagram
memories captions for instagram,150,0,,Creator Assets,Captions & Bios,TOF,"Ads, Digital Product","Informational,Branded,Non-local",Image sharing,memories captions
bachelorette party instagram captions,150,0,0.06,Creator Assets,Captions & Bios,TOF,"Ads, Digital Product","Informational,Non-branded,Non-local",Social networks,bachelorette captions
21st birthday captions for instagram,150,0,,Creator Assets,Captions & Bios,TOF,"Ads, Digital Product","Informational,Non-branded,Non-local",Social networks,21st birthday captions
drake captions for instagram,150,0,0.02,Creator Assets,Captions & Bios,TOF,"Ads, Digital Product","Informational,Non-branded,Non-local",Hip-hop,drake lyrics for captions
bible verses for instagram bio for girl,150,0,,Creator Assets,Captions & Bios,TOF,"Ads, Digital Product","Informational,Non-branded,Non-local",Books; Social networks,bible verses for instagram bio
mom captions for instagram,150,0,,Creator Assets,Captions & Bios,TOF,"Ads, Digital Product","Informational,Non-branded,Non-local",Social networks,mothers day caption for instagram
mother's day instagram caption,150,0,,Creator Assets,Captions & Bios,TOF,"Ads, Digital Product","Informational,Non-branded,Non-local",Social networks,mothers day caption for instagram
yoga captions for instagram,150,0,,Creator Assets,Captions & Bios,TOF,"Ads, Digital Product","Informational,Non-branded,Non-local",Pilates,yoga captions
disneyland captions for instagram,150,0,,Creator Assets,Captions & Bios,TOF,"Ads, Digital Product","Informational,Branded,Non-local",Online media; Image sharing,disney instagram captions
short captions for mom on instagram,150,0,,Creator Assets,Captions & Bios,TOF,"Ads, Digital Product","Informational,Non-branded,Non-local",Social networks,mother captions for instagram
mother captions for instagram,150,0,,Creator Assets,Captions & Bios,TOF,"Ads, Digital Product","Informational,Non-branded,Non-local",Social networks,mothers day caption for instagram
mothers day caption for instagram,150,0,,Creator Assets,Captions & Bios,TOF,"Ads, Digital Product","Informational,Non-branded,Non-local",Social networks,mothers day caption for instagram
instagram self quotes,150,10,0.03,Creator Assets,Captions & Bios,TOF,"Ads, Digital Product","Informational,Branded,Non-local",Social networks,captions for instagram
costa rica instagram captions,100,0,,Creator Assets,Captions & Bios,TOF,"Ads, Digital Product","Informational,Non-branded,Non-local",Tourist destinations,costa rica instagram captions
aesthetic flower captions for instagram,100,0,,Creator Assets,Captions & Bios,TOF,"Ads, Digital Product","Informational,Non-branded,Non-local",Online media,flower captions for instagram
bachelorette captions for instagram,100,0,0.02,Creator Assets,Captions & Bios,TOF,"Ads, Digital Product","Informational,Non-branded,Non-local",Trivia,bachelorette instagram captions
ireland instagram captions,100,0,,Creator Assets,Captions & Bios,TOF,"Ads, Digital Product","Informational,Non-branded,Non-local",Social networks,ireland instagram captions
harry potter instagram captions,100,0,,Creator Assets,Captions & Bios,TOF,"Ads, Digital Product","Informational,Non-branded,Non-local",Animation; Online media; TV,harry potter captions
flowers captions for instagram,100,0,0.01,Creator Assets,Captions & Bios,TOF,"Ads, Digital Product","Informational,Non-branded,Non-local",Entertainment,flower instagram captions
funny hiking captions for instagram,100,0,0.01,Creator Assets,Captions & Bios,TOF,"Ads, Digital Product","Informational,Non-branded,Non-local",Videos,hiking puns
fashion quotes for instagram,100,0,0.01,Creator Assets,Captions & Bios,TOF,"Ads, Digital Product","Informational,Non-branded,Non-local",Entertainment,fashion quotes for instagram
rome instagram captions,100,0,,Creator Assets,Captions & Bios,TOF,"Ads, Digital Product","Informational,Non-branded,Non-local",Online media,rome captions
pumpkin captions for instagram,100,0,0.01,Creator Assets,Captions & Bios,TOF,"Ads, Digital Product","Informational,Non-branded,Non-local",Trivia,pumpkin quotes for instagram
pumpkin instagram captions,100,1,0.02,Creator Assets,Captions & Bios,TOF,"Ads, Digital Product","Informational,Non-branded,Non-local",Social networks,pumpkin instagram captions
mother's day instagram captions,100,1,0.02,Creator Assets,Captions & Bios,TOF,"Ads, Digital Product","Informational,Non-branded,Non-local",Social networks,mothers day caption
mother's day captions for instagram,100,1,,Creator Assets,Captions & Bios,TOF,"Ads, Digital Product","Informational,Non-branded,Non-local",Social networks,mothers day caption
tiktok caption best practices,100,5,5,Creator Assets,Captions & Bios,MOF,"Affiliate, Digital Product","Informational,Non-branded,Non-local",Online media,tiktok caption best practices
short bio for instagram for girl,100,10,,Creator Assets,Captions & Bios,TOF,"Ads, Digital Product","Informational,Non-branded,Non-local",Social networks,instagram bio for girls
self love instagram captions,100,13,0.02,Creator Assets,Captions & Bios,TOF,"Ads, Digital Product","Informational,Non-branded,Non-local",Motivational,captions for instagram
instagram post ideas,2000,0,0.45,Creator Assets,Content Ideas,TOF,"Ads, Digital Product","Informational,Non-branded,Non-local",Social networks,instagram post ideas
funny facebook status,700,0,0.05,Creator Assets,Content Ideas,TOF,"Ads, Digital Product","Informational,Non-branded,Non-local",Social networks,funny facebook status
how to make instagram story longer,500,2,0.03,Creator Assets,Content Ideas,TOF,"Ads, Digital Product","Informational,Branded,Non-local",Social networks,how long do stories last on instagram
christmas cover photos for facebook,400,0,0.2,Creator Assets,Content Ideas,TOF,"Ads, Digital Product","Informational,Branded,Non-local",Wallpapers,cute christmas cover photos for facebook
fake instagram story,400,0,0,Creator Assets,Content Ideas,TOF,"Ads, Digital Product","Informational,Branded,Non-local",Add-ons; Social networks,fake instagram story template
summer facebook cover photos,300,0,,Creator Assets,Content Ideas,TOF,"Ads, Digital Product","Informational,Non-branded,Non-local",Wallpapers,cute summer facebook cover
veterinary facebook post ideas,250,0,,Creator Assets,Content Ideas,TOF,"Ads, Digital Product","Informational,Non-branded,Non-local",Social networks; Veterinarians,vet social media
girly facebook cover photos,250,0,,Creator Assets,Content Ideas,TOF,"Ads, Digital Product","Informational,Non-branded,Non-local",Wallpapers,girly facebook cover photos
christian cover photos for facebook,200,0,,Creator Assets,Content Ideas,TOF,"Ads, Digital Product","Informational,Non-branded,Non-local",Wallpapers,christian facebook cover photos
easter facebook cover,200,0,,Creator Assets,Content Ideas,TOF,"Ads, Digital Product","Informational,Non-branded,Non-local",Wallpapers,religious easter facebook covers
easter cover photos for facebook,200,0,,Creator Assets,Content Ideas,TOF,"Ads, Digital Product","Informational,Branded,Non-local",Wallpapers,easter facebook cover
bible verse cover photo for facebook,150,0,,Creator Assets,Content Ideas,TOF,"Ads, Digital Product","Informational,Non-branded,Non-local",Image sharing; Social networks; Belief,bible verse facebook cover photos
religious easter facebook cover photos,150,0,,Creator Assets,Content Ideas,TOF,"Ads, Digital Product","Informational,Non-branded,Non-local",Wallpapers; Belief,easter facebook cover
religious easter facebook covers,150,0,,Creator Assets,Content Ideas,TOF,"Ads, Digital Product","Informational,Non-branded,Non-local",Wallpapers; Belief,religious easter facebook covers
real estate instagram post ideas,150,0,1.5,Creator Assets,Content Ideas,MOF,Digital Product,"Informational,Commercial,Non-branded,Non-local",Social networks; Real estate services,real estate instagram post ideas
christian facebook covers,150,0,0.2,Creator Assets,Content Ideas,TOF,"Ads, Digital Product","Informational,Non-branded,Non-local",Wallpapers,bible verse facebook cover
cute summer facebook cover,150,0,,Creator Assets,Content Ideas,TOF,"Ads, Digital Product","Informational,Non-branded,Non-local",Wallpapers,cute summer facebook cover
private instagram story,150,12,0.5,Creator Assets,Content Ideas,TOF,"Ads, Digital Product","Informational,Branded,Non-local",Social networks,instagram story viewer
unique memorial day facebook covers,100,0,,Creator Assets,Content Ideas,TOF,"Ads, Digital Product","Informational,Non-branded,Non-local",Wallpapers,unique memorial day facebook covers
funny facebook status updates,100,0,,Creator Assets,Content Ideas,TOF,"Ads, Digital Product","Informational,Non-branded,Non-local",Social networks,funny facebook status
new year facebook covers,100,0,0.09,Creator Assets,Content Ideas,TOF,"Ads, Digital Product","Informational,Non-branded,Non-local",Wallpapers,facebook new year cover photos
faith bible verse facebook covers,100,0,,Creator Assets,Content Ideas,TOF,"Ads, Digital Product","Informational,Non-branded,Non-local",Belief,christian facebook cover photos
summer facebook cover,100,0,,Creator Assets,Content Ideas,TOF,"Ads, Digital Product","Informational,Non-branded,Non-local",Wallpapers,summer facebook cover photos
how to use instagram stories for business,100,16,0.4,Creator Assets,Content Ideas,TOF,"Ads, Digital Product","Informational,Branded,Non-local",Brand; Marketing; Social networks,insta stories
happy tiktok emoji,4900,0,,Creator Assets,Emojis & Emoticons,TOF,"Ads, Affiliate","Informational,Branded,Non-local",Social networks,tiktok emojis
tiktok emoji png,3100,0,,Creator Assets,Emojis & Emoticons,TOF,Ads,"Informational,Branded,Non-local",Online image galleries,tiktok emoji png
tiktok emojis png,2900,0,0.25,Creator Assets,Emojis & Emoticons,TOF,Ads,"Informational,Branded,Non-local",Online image galleries,tiktok emoji png
all tiktok emojis,1800,6,,Creator Assets,Emojis & Emoticons,TOF,Ads,"Informational,Branded,Non-local",Social networks,tiktok emojis
tiktok emoji copy paste,1700,6,,Creator Assets,Emojis & Emoticons,TOF,Ads,"Informational,Branded,Non-local",Social networks,tiktok emojis png
tiktok emojis copy and paste,1500,11,0.05,Creator Assets,Emojis & Emoticons,TOF,Ads,"Informational,Branded,Non-local",Social networks,tiktok emoji png
pink tiktok emoji,700,0,,Creator Assets,Emojis & Emoticons,TOF,Ads,"Informational,Branded,Non-local",Social networks,tiktok emojis
tiktok emoji list,600,2,0.15,Creator Assets,Emojis & Emoticons,TOF,Ads,"Informational,Branded,Non-local",Social networks,tiktok emojis
tiktok hehe emoji,500,0,,Creator Assets,Emojis & Emoticons,TOF,Ads,"Informational,Branded,Non-local",Social networks,hehe tiktok emoji
disdain tiktok emoji,450,0,,Creator Assets,Emojis & Emoticons,TOF,Ads,"Informational,Branded,Non-local",Online media,tiktok emojis
speechless tiktok emoji,400,0,,Creator Assets,Emojis & Emoticons,TOF,Ads,"Informational,Branded,Non-local",Online media,tiktok emojis
tiktok emoji copy and paste,400,4,0.05,Creator Assets,Emojis & Emoticons,TOF,Ads,"Informational,Branded,Non-local",Social networks,tiktok emojis
tiktok emoji hehe,350,0,,Creator Assets,Emojis & Emoticons,TOF,Ads,"Informational,Branded,Non-local",Social networks,tiktok emojis
transparent background tiktok emojis png,350,0,,Creator Assets,Emojis & Emoticons,TOF,Ads,"Informational,Branded,Non-local",Online image galleries,tiktok emoji png
tiktok emoji transparent,350,0,0.04,Creator Assets,Emojis & Emoticons,TOF,Ads,"Informational,Branded,Non-local",Online image galleries,tiktok emoji png
tiktok emoji meme,250,1,,Creator Assets,Emojis & Emoticons,TOF,Ads,"Informational,Branded,Non-local",Online media; Online video,tiktok emoji meme
tiktok screaming emoji,250,6,,Creator Assets,Emojis & Emoticons,TOF,Ads,"Informational,Branded,Non-local",Social networks,tiktok emojis
youtube emotes,200,0,0.1,Creator Assets,Emojis & Emoticons,TOF,Ads,"Informational,Branded,Non-local",Online goodies,youtube emoji
youtube emoji copy paste,200,1,,Creator Assets,Emojis & Emoticons,TOF,Ads,"Informational,Branded,Non-local",Online media,youtube emoji
laughing tiktok emoji,200,6,,Creator Assets,Emojis & Emoticons,TOF,Ads,"Informational,Branded,Non-local",Online media,tiktok emojis
tiktok emojis list,200,8,0.03,Creator Assets,Emojis & Emoticons,TOF,Ads,"Informational,Branded,Non-local",Social networks,tiktok emojis
facebook emojis and their meaning,200,19,,Creator Assets,Emojis & Emoticons,TOF,Ads,"Informational,Branded,Non-local",Social networks,facebook emojis
tiktok white emoji,150,0,,Creator Assets,Emojis & Emoticons,TOF,Ads,"Informational,Branded,Non-local",Social networks,white emojis
funny emoji faces tiktok,150,0,,Creator Assets,Emojis & Emoticons,TOF,Ads,"Informational,Branded,Non-local",Videos,tiktok emojis
emojis for youtube description,150,0,,Creator Assets,Emojis & Emoticons,TOF,Ads,"Informational,Branded,Non-local",Online media,emojis for youtube description
tiktok emote,150,1,0.2,Creator Assets,Emojis & Emoticons,TOF,Ads,"Informational,Branded,Non-local",Social networks,tiktok emojis
copy and paste tiktok emojis,150,1,,Creator Assets,Emojis & Emoticons,TOF,Ads,"Informational,Branded,Non-local",Social networks,tiktok emojis
funny tiktok emojis,150,1,,Creator Assets,Emojis & Emoticons,TOF,Ads,"Informational,Branded,Non-local",Videos; Online media,funny emoji faces tiktok
tiktok emoji faces,150,2,,Creator Assets,Emojis & Emoticons,TOF,Ads,"Informational,Branded,Non-local",Social networks,tiktok emojis
facebook emoji meaning,150,19,0.03,Creator Assets,Emojis & Emoticons,TOF,Ads,"Informational,Branded,Non-local",Social networks,care emoji
discord tiktok emojis png,100,0,,Creator Assets,Emojis & Emoticons,TOF,Ads,"Informational,Branded,Non-local",Animated gifs,tiktok emojis
happy tiktok emoji copy and paste,100,1,,Creator Assets,Emojis & Emoticons,TOF,"Ads, Affiliate","Informational,Branded,Non-local",Social networks,tiktok emojis png
tiktok emoji face,100,3,,Creator Assets,Emojis & Emoticons,TOF,Ads,"Informational,Branded,Non-local",Social networks,tiktok emojis
tiktok font,3200,12,0.06,Creator Assets,Fonts & Text,TOF,"Ads, Digital Product","Informational,Branded,Non-local",Online media,tiktok font
pink tiktok logo,1200,0,,Creator Assets,General,TOF,Ads,"Informational,Branded,Non-local",Design,pink tiktok icon
best category for instagram professional account,900,8,,Creator Assets,General,MOF,Affiliate,"Informational,Branded,Non-local",Social networks,instagram professional account categories
instagram professional account categories,800,6,4.5,Creator Assets,General,TOF,Ads,"Informational,Non-branded,Non-local",Social networks,instagram professional account categories
what does hmj mean on instagram,700,0,,Creator Assets,General,TOF,Ads,"Informational,Non-branded,Non-local",Social networks,what does hmj mean in text
what does cf mean on instagram,600,0,,Creator Assets,General,TOF,Ads,"Informational,Branded,Non-local",Social networks,abbreviation for close friends on instagram
tiktok emoticons,500,1,,Creator Assets,General,TOF,Ads,"Informational,Branded,Non-local",Social networks,tiktok emojis
instagram categories,450,3,,Creator Assets,General,TOF,Ads,"Informational,Branded,Non-local",Social networks,best category for instagram professional account
instagram creator categories,400,4,,Creator Assets,General,TOF,Ads,"Informational,Branded,Non-local",Social networks,best category for instagram professional account
best instagram professional categories,350,1,4,Creator Assets,General,MOF,Affiliate,"Informational,Branded,Non-local",Social networks,instagram professional account categories
categories for instagram,350,3,,Creator Assets,General,TOF,Ads,"Informational,Branded,Non-local",Social networks,best category for instagram professional account
best professional account instagram,300,6,,Creator Assets,General,MOF,Affiliate,"Informational,Commercial,Branded,Non-local",Brand; Marketing; Social networks,best professional account instagram
tdy meaning in text instagram,250,0,,Creator Assets,General,TOF,Ads,"Informational,Branded,Non-local",/Other,tdy meaning in text
cf meaning instagram,250,0,,Creator Assets,General,TOF,Ads,"Informational,Branded,Non-local",Social networks,what does cf mean on instagram
instagram profile categories,250,7,,Creator Assets,General,TOF,Ads,"Informational,Non-branded,Non-local",Social networks,best category for instagram professional account
imsg meaning text instagram,200,0,,Creator Assets,General,TOF,Ads,"Informational,Branded,Non-local",Social networks,what does imsg mean
cf meaning text instagram,200,0,,Creator Assets,General,TOF,Ads,"Informational,Branded,Non-local",Social networks,what is cf social media
what does archive on instagram mean,200,0,,Creator Assets,General,TOF,Ads,"Informational,Branded,Non-local",Social networks,instagram archive
the boys youtube logo,200,2,,Creator Assets,General,TOF,Ads,"Informational,Branded,Non-local",Online video,the boys youtube
instagram content calendar template google sheets,200,7,3,Creator Assets,General,TOF,Ads,"Informational,Branded,Non-local",Social networks,content calendar template google sheets
tiktok logo pink,150,0,,Creator Assets,General,MOF,Ads,"Informational,Commercial,Branded,Non-local",Online image galleries,pink tiktok logo
meaning of instagram symbols,150,0,,Creator Assets,General,TOF,Ads,"Informational,Branded,Non-local",Social networks,instagram icon meanings
tiktok slideshow template,150,0,0.8,Creator Assets,General,TOF,Ads,"Informational,Branded,Non-local",Online media; Online video,tiktok slideshow template
what are all the icons on instagram,100,0,,Creator Assets,General,TOF,Ads,"Informational,Branded,Non-local",Social networks,instagram icons meaning
instagram powerpoint template,100,0,1.3,Creator Assets,General,TOF,Ads,"Informational,Branded,Non-local",Entertainment,instagram powerpoint template
what does wtd mean on instagram,100,0,,Creator Assets,General,TOF,Ads,"Informational,Branded,Non-local",Social networks,what does wtd mean in texting
what does omp mean on instagram,100,0,,Creator Assets,General,TOF,Ads,"Informational,Non-branded,Non-local",Social networks,omp meaning in text
tiktok emoticon,100,3,,Creator Assets,General,TOF,Ads,"Informational,Branded,Non-local",Social networks,tiktok emojis
instagram business categories,100,6,1.2,Creator Assets,General,TOF,Ads,"Informational,Non-branded,Non-local",Brand; Marketing; Business plans,instagram professional account categories
instagram grid,1800,10,0.8,Creator Assets,Grid & Layout Tools,TOF,"Ads, Digital Product","Informational,Non-branded,Non-local",Social networks,my social boutique
grid for instagram,200,11,0.9,Creator Assets,Grid & Layout Tools,TOF,"Ads, Digital Product","Informational,Branded,Non-local",Online media; Design,mysocialboutique
grid post instagram,150,10,0.9,Creator Assets,Grid & Layout Tools,TOF,"Ads, Digital Product","Informational,Branded,Non-local",Social networks,grid post
instagram grid planner free,100,0,1.2,Creator Assets,Grid & Layout Tools,TOF,"Ads, Digital Product","Informational,Branded,Non-local",Social networks,instagram grid planner
grid planning instagram,100,1,0.9,Creator Assets,Grid & Layout Tools,TOF,"Ads, Digital Product","Informational,Branded,Non-local",Social networks,instagram grid planner
9 grid instagram,100,1,0.3,Creator Assets,Grid & Layout Tools,TOF,"Ads, Digital Product","Informational,Branded,Non-local",Social networks,instagram 9 grid
grid maker for instagram,100,9,0.6,Creator Assets,Grid & Layout Tools,TOF,"Ads, Digital Product","Informational,Branded,Non-local",Online media,my social boutique
instagram photo grid,100,12,0.8,Creator Assets,Grid & Layout Tools,TOF,"Ads, Digital Product","Informational,Branded,Non-local",Social networks,instagram grid maker
instagram layout planner,100,15,0.9,Creator Assets,Grid & Layout Tools,TOF,"Ads, Digital Product","Informational,Branded,Non-local",Social networks,instagram grid planner
instagram reels safe zone,500,0,40,Creator Assets,Safe Zones & Templates,TOF,"Ads, Affiliate (VPN), Digital Product","Informational,Branded,Non-local",Sharing,safe zone for instagram reels
tiktok safe zone template,250,0,5,Creator Assets,Safe Zones & Templates,TOF,"Ads, Affiliate (VPN), Digital Product","Informational,Branded,Non-local",Online media,tiktok safe zone
instagram reels safe zone template,250,0,3.5,Creator Assets,Safe Zones & Templates,TOF,"Ads, Affiliate (VPN), Digital Product","Informational,Branded,Non-local",Sharing,instagram reels safe zone template
instagram reel overlay,250,0,1.9,Creator Assets,Safe Zones & Templates,TOF,"Ads, Digital Product","Informational,Branded,Non-local",Online media; Online video,instagram safe zone template
instagram safe zones,200,0,,Creator Assets,Safe Zones & Templates,TOF,"Ads, Affiliate (VPN), Digital Product","Informational,Branded,Non-local",Social networks,instagram story safe zone
youtube shorts safe zone,200,0,,Creator Assets,Safe Zones & Templates,TOF,"Ads, Affiliate (VPN), Digital Product","Informational,Branded,Non-local",Online video,youtube shorts safe zone
instagram reel safe zone template,200,2,3.5,Creator Assets,Safe Zones & Templates,TOF,"Ads, Affiliate (VPN), Digital Product","Informational,Branded,Non-local",Online media,instagram safe zone template
youtube safe zones,150,0,,Creator Assets,Safe Zones & Templates,TOF,"Ads, Affiliate (VPN), Digital Product","Informational,Branded,Non-local",Marketing,youtube safe zone
instagram story safe zone template,150,0,,Creator Assets,Safe Zones & Templates,TOF,"Ads, Affiliate (VPN), Digital Product","Informational,Branded,Non-local",Social networks,instagram safe zone template
safe zone instagram reels,150,6,,Creator Assets,Safe Zones & Templates,TOF,"Ads, Affiliate (VPN), Digital Product","Informational,Branded,Non-local",Online media,instagram story safe zone
instagram reel safe zones,100,3,,Creator Assets,Safe Zones & Templates,TOF,"Ads, Affiliate (VPN), Digital Product","Informational,Branded,Non-local",Social networks,instagram story safe zone
youtube thumbnail resizer,1100,1,0.8,Creator Assets,Thumbnail Tools,BOF,Digital Product,"Informational,Non-branded,Non-local",Multimedia,youtube thumbnail size
youtube thumbnail preview,250,7,0.4,Creator Assets,Thumbnail Tools,MOF,"Affiliate, Digital Product","Informational,Branded,Non-local",Online media,thumbnail tester
youtube thumbnail resize,200,1,0.8,Creator Assets,Thumbnail Tools,TOF,"Ads, Digital Product","Informational,Branded,Non-local",Entertainment,youtube thumbnail size
best colors for youtube thumbnails,100,0,,Creator Assets,Thumbnail Tools,MOF,"Affiliate, Digital Product","Informational,Non-branded,Non-local",Online media,best color for youtube thumbnail
tiktok name generator,1800,7,0.06,Creator Assets,Usernames & Names,BOF,Digital Product,"Informational,Branded,Non-local",Social networks,tiktok username ideas
nombres para instagram,1200,0,0.04,Creator Assets,Usernames & Names,TOF,"Ads, Digital Product","Informational,Branded,Non-local",Social networks,nombres de usuario para instagram
instagram usernames for sale,300,0,0.9,Creator Assets,Usernames & Names,BOF,Digital Product,"Commercial,Transactional,Non-branded,Non-local",Social networks,instagram usernames for sale
instagram username availability tool,250,4,,Creator Assets,Usernames & Names,TOF,"Ads, Affiliate, Digital Product","Informational,Non-branded,Non-local",Social networks,instagram name checker
buy instagram username,250,11,0.7,Creator Assets,Usernames & Names,BOF,Digital Product,"Commercial,Transactional,Non-branded,Non-local",Social networks,buy instagram username
rare instagram usernames,150,0,2.5,Creator Assets,Usernames & Names,TOF,"Ads, Digital Product","Informational,Branded,Non-local",Social networks,rare instagram usernames
rare instagram usernames for sale,150,0,,Creator Assets,Usernames & Names,BOF,Digital Product,"Commercial,Transactional,Non-branded,Non-local",Social networks,instagram usernames for sale
search instagram comments by username,100,0,1.1,Creator Assets,Usernames & Names,TOF,"Ads, Digital Product","Informational,Non-branded,Non-local",Social networks,instagram comment viewer
instagram username history,100,0,0.8,Creator Assets,Usernames & Names,TOF,"Ads, Digital Product","Informational,Branded,Non-local",Social networks,instagram username history
how to see past instagram usernames,100,0,,Creator Assets,Usernames & Names,TOF,"Ads, Digital Product","Informational,Non-branded,Non-local",Social networks,how to see past usernames on instagram
